"produktkod","namn","beskrivning","pris","kategori"
"kaffe1","Kaffemugg med dbwebb-tryck","En vacker snövit keramisk kaffemugg med högupplöst flerfärgstryck från dbwebb.","69","muggar"
"te1","Temugg med dbwebb-tryck","En ståtlig matt helsvart temugg, extra stor, med grön dbwebb-logo, för sköna stunder framför datorn.","79","muggar"
"kaffemix1","Kaffeblandning med dbwebb-krydda","En egenbryggd kaffeblandning för aktiva studiedagara, utan paus, spetsad med dbwebb-krydda.","49","kaffeblandning"
"skiva1","Skiva där BTHs lärarkår sjunger sånger","BTHs samlade lärarkår sjunger studiemotiverande sångar, inkluderar länk till online spellista.","199","skivor"
"kaffe2","Kaffemugg med Glenn Hysén-tryck","En rolig bild på Glenn Hysén där han drar ett Göteborgsskämt","59","muggar"